{
    "type": "ywzj_vehicle:wheeled_vehicle",
    "attributes": {
        "brake_force": 165000,
        "forward_force": 132000,
        "backward_force": 132000,
        "max_speed_forward": 0.8,
        "max_speed_backward": 0.2,
        "turn_step": 0.4,
        "max_turn": 2
    },
    "physics_info": {
        "mass": 16500,
        "friction": 33000,
        "suspension_response": 0.6,
        "center": [0, -2, 0]
    },
    "max_health": 2000,
    "view_info": {
        "third_person_center_offset": [0, 4, 0],
        "third_person_distance": 10,
        "third_person_center_offset_zoomed": [0, 5, 0],
        "third_person_distance_zoomed": 0,
        "sound_distance": 3
    },
    "energy_info": {
        "energy_capacity": 300,
        "energy_consumption_per_tick": 0.000763889,
        "engine_particle_offsets": [[-1.563, 1.875, 1.375]]
    },
    "structure_model": "ywzj_vehicle:vehicle/cssa5",
    "parts": [
        {
            "id": "turret",
            "name": "part.ywzj_vehicle.turret",
            "type": "ywzj_vehicle:weapon",
            "max_health": 600,
            "render_bone": "turret",
            "structure_bone": "turret",
            "seat_offset": [0.471875, 1.8546875, 1.94375],
            "operator_on_weapon_unit": false,
            "crosshair_style": "circle",
            "rot_info": {
                "x_rot_speed": 3,
                "y_rot_speed": 3,
                "x_rot_max": 4,
                "x_rot_min": -85
            },
            "optical_sight_offset": [0.719, 0.883, 0.14],
            "operator_view_offset": [0.471875, -0.3, 2.31875],
            "optical_sight_type": "crt",
            "with_stabilizer": true,
            "with_thermal_imager": true,
            "zoom_max": 12,
            "sub_part_unit_ids": ["radar"],
            "weapons": [
                "ywzj_vehicle:pgz_625",
                {
                    "id": "ywzj_vehicle:fb_10",
                    "part_unit_id": "turret_missile"
                },
                {
                    "id": "ywzj_vehicle:launcher_smoke_grenade",
                    "part_unit_id": "turret_smoke_grenade"
                }
            ]
        },
        {
            "id": "turret_missile",
            "name": "part.ywzj_vehicle.missile",
            "type": "ywzj_vehicle:weapon",
            "structure_bone": "turret_missile",
            "fire_control_sensor_type": "rf",
            "crosshair_style": "none",
            "is_seat": false,
            "parent_weapon_unit_aim": true,
            "rot_info": {
                "x_rot_speed": 1.5,
                "y_rot_speed": 0,
                "x_rot_max": 5,
                "x_rot_min": -60
            }
        },
        {
            "id": "turret_smoke_grenade",
            "name": "part.ywzj_vehicle.turret_smoke_grenade",
            "type": "ywzj_vehicle:weapon",
            "structure_bone": "turret_smoke_grenade",
            "is_seat": false,
            "rot_info": {
                "x_rot_speed": 0,
                "y_rot_speed": 0
            }
        },
        {
            "id": "radar",
            "name": "part.ywzj_vehicle.radar",
            "type": "ywzj_vehicle:radar",
            "max_health": 200,
            "render_bone": "obj_center",
            "structure_bone": "radar",
            "is_seat": false,
            "rot_info": {
                "x_rot_speed": 0,
                "y_rot_speed": 15,
                "x_rot": -45
            },
            "radar_type": "PLB-625",
            "scan_sector_angle": 80,
            "max_scan_distance": 4096
        },
        {
            "id": "suspension_wheel1",
            "name": "part.ywzj_vehicle.wheel",
            "type": "ywzj_vehicle:suspension",
            "max_health": 50,
            "defense_stats": {
                "damage_threshold": 0
            },
            "render_bone": "wheel1",
            "structure_bone": "wheel1",
            "is_seat": false,
            "spring_stiffness": 247500,
            "damping": 20325,
            "rest_length": 0.35,
            "max_compression": 0.35,
            "max_extension": 0.22,
            "max_droop": 0.26
        },
        {
            "id": "suspension_wheel4",
            "name": "part.ywzj_vehicle.wheel",
            "type": "ywzj_vehicle:suspension",
            "max_health": 50,
            "defense_stats": {
                "damage_threshold": 0
            },
            "render_bone": "wheel4",
            "structure_bone": "wheel4",
            "is_seat": false,
            "spring_stiffness": 247500,
            "damping": 20325,
            "rest_length": 0.35,
            "max_compression": 0.35,
            "max_extension": 0.22,
            "max_droop": 0.26
        },
        {
            "id": "suspension_wheel6",
            "name": "part.ywzj_vehicle.wheel",
            "type": "ywzj_vehicle:suspension",
            "max_health": 50,
            "defense_stats": {
                "damage_threshold": 0
            },
            "render_bone": "wheel6",
            "structure_bone": "wheel6",
            "is_seat": false,
            "spring_stiffness": 247500,
            "damping": 20325,
            "rest_length": 0.35,
            "max_compression": 0.35,
            "max_extension": 0.22,
            "max_droop": 0.26
        },
        {
            "id": "suspension_wheel8",
            "name": "part.ywzj_vehicle.wheel",
            "type": "ywzj_vehicle:suspension",
            "max_health": 50,
            "defense_stats": {
                "damage_threshold": 0
            },
            "render_bone": "wheel8",
            "structure_bone": "wheel8",
            "is_seat": false,
            "spring_stiffness": 247500,
            "damping": 20325,
            "rest_length": 0.35,
            "max_compression": 0.35,
            "max_extension": 0.22,
            "max_droop": 0.26
        },
        {
            "id": "suspension_wheel2",
            "name": "part.ywzj_vehicle.wheel",
            "type": "ywzj_vehicle:suspension",
            "max_health": 50,
            "defense_stats": {
                "damage_threshold": 0
            },
            "render_bone": "wheel2",
            "structure_bone": "wheel2",
            "is_seat": false,
            "spring_stiffness": 247500,
            "damping": 20325,
            "rest_length": 0.35,
            "max_compression": 0.35,
            "max_extension": 0.22,
            "max_droop": 0.26
        },
        {
            "id": "suspension_wheel3",
            "name": "part.ywzj_vehicle.wheel",
            "type": "ywzj_vehicle:suspension",
            "max_health": 50,
            "defense_stats": {
                "damage_threshold": 0
            },
            "render_bone": "wheel3",
            "structure_bone": "wheel3",
            "is_seat": false,
            "spring_stiffness": 247500,
            "damping": 20325,
            "rest_length": 0.35,
            "max_compression": 0.35,
            "max_extension": 0.22,
            "max_droop": 0.26
        },
        {
            "id": "suspension_wheel5",
            "name": "part.ywzj_vehicle.wheel",
            "type": "ywzj_vehicle:suspension",
            "max_health": 50,
            "defense_stats": {
                "damage_threshold": 0
            },
            "render_bone": "wheel5",
            "structure_bone": "wheel5",
            "is_seat": false,
            "spring_stiffness": 247500,
            "damping": 20325,
            "rest_length": 0.35,
            "max_compression": 0.35,
            "max_extension": 0.22,
            "max_droop": 0.26
        },
        {
            "id": "suspension_wheel7",
            "name": "part.ywzj_vehicle.wheel",
            "type": "ywzj_vehicle:suspension",
            "max_health": 50,
            "defense_stats": {
                "damage_threshold": 0
            },
            "render_bone": "wheel7",
            "structure_bone": "wheel7",
            "is_seat": false,
            "spring_stiffness": 247500,
            "damping": 20325,
            "rest_length": 0.35,
            "max_compression": 0.35,
            "max_extension": 0.22,
            "max_droop": 0.26
        }
    ]
}
