{
    "type": "ywzj_vehicle:wheeled_vehicle",
    "attributes": {
        "brake_force": 8670,
        "forward_force": 6936,
        "backward_force": 6936,
        "max_speed_forward": 0.8,
        "max_speed_backward": 0.2,
        "turn_step": 0.4,
        "max_turn": 2
    },
    "physics_info": {
        "mass": 867,
        "friction": 1734,
        "suspension_response": 0.4,
        "center": [0, -1, 0]
    },
    "max_health": 300,
    "defense_stats": {
        "damage_threshold": 10
    },
    "protect_passenger": false,
    "view_info": {
        "third_person_center_offset": [0, 4, 0],
        "third_person_distance": 8,
        "third_person_center_offset_zoomed": [0, 3, 0],
        "third_person_distance_zoomed": 0,
        "sound_distance": 3
    },
    "energy_info": {
        "energy_capacity": 27,
        "energy_consumption_per_tick": 0.000138889
    },
    "structure_model": "ywzj_vehicle:vehicle/atv_mrzr4",
    "parts": [
        {
            "id": "seat0",
            "name": "part.ywzj_vehicle.seat",
            "type": "ywzj_vehicle:generic",
            "is_seat": true,
            "passenger_pose": {
                "left_arm_rot_x": 4.7,
                "right_arm_rot_x": 4.7
            },
            "seat_offset": [0.4, 1.9, 0.2],
            "owner_view_offset": [0.4, 1.9, 0.2]
        },
        {
            "id": "seat1",
            "name": "part.ywzj_vehicle.seat",
            "type": "ywzj_vehicle:generic",
            "is_seat": true,
            "seat_offset": [-0.4, 1.9, 0.2],
            "owner_view_offset": [-0.4, 1.9, 0.2]
        },
        {
            "id": "seat2",
            "name": "part.ywzj_vehicle.seat",
            "type": "ywzj_vehicle:generic",
            "is_seat": true,
            "seat_offset": [0.4, 2.1, -0.8],
            "owner_view_offset": [0.4, 2.1, -0.8]
        },
        {
            "id": "seat3",
            "name": "part.ywzj_vehicle.seat",
            "type": "ywzj_vehicle:generic",
            "is_seat": true,
            "seat_offset": [-0.4, 2.1, -0.8],
            "owner_view_offset": [-0.4, 2.1, -0.8]
        },
        {
            "id": "suspension_ctr_wheel_f_l",
            "name": "part.ywzj_vehicle.wheel",
            "type": "ywzj_vehicle:suspension",
            "max_health": 50,
            "defense_stats": {
                "damage_threshold": 0
            },
            "render_bone": "ctr_wheel_f_l",
            "structure_bone": "ctr_wheel_f_l",
            "is_seat": false,
            "spring_stiffness": 26010,
            "damping": 2025,
            "rest_length": 0.35,
            "max_compression": 0.35,
            "max_extension": 0.22,
            "max_droop": 0.2
        },
        {
            "id": "suspension_ctr_wheel_f_r",
            "name": "part.ywzj_vehicle.wheel",
            "type": "ywzj_vehicle:suspension",
            "max_health": 50,
            "defense_stats": {
                "damage_threshold": 0
            },
            "render_bone": "ctr_wheel_f_r",
            "structure_bone": "ctr_wheel_f_r",
            "is_seat": false,
            "spring_stiffness": 26010,
            "damping": 2025,
            "rest_length": 0.35,
            "max_compression": 0.35,
            "max_extension": 0.22,
            "max_droop": 0.2
        },
        {
            "id": "suspension_ctr_wheel_b_l",
            "name": "part.ywzj_vehicle.wheel",
            "type": "ywzj_vehicle:suspension",
            "max_health": 50,
            "defense_stats": {
                "damage_threshold": 0
            },
            "render_bone": "ctr_wheel_b_l",
            "structure_bone": "ctr_wheel_b_l",
            "is_seat": false,
            "spring_stiffness": 26010,
            "damping": 2025,
            "rest_length": 0.35,
            "max_compression": 0.35,
            "max_extension": 0.22,
            "max_droop": 0.2
        },
        {
            "id": "suspension_ctr_wheel_b_r",
            "name": "part.ywzj_vehicle.wheel",
            "type": "ywzj_vehicle:suspension",
            "max_health": 50,
            "defense_stats": {
                "damage_threshold": 0
            },
            "render_bone": "ctr_wheel_b_r",
            "structure_bone": "ctr_wheel_b_r",
            "is_seat": false,
            "spring_stiffness": 26010,
            "damping": 2025,
            "rest_length": 0.35,
            "max_compression": 0.35,
            "max_extension": 0.22,
            "max_droop": 0.2
        },
        {
            "id": "hook_front",
            "name": "part.ywzj_vehicle.hook_front",
            "type": "ywzj_vehicle:hook",
            "structure_bone": "hook_front",
            "is_seat": false,
            "detachable": false
        },
        {
            "id": "hook_rear",
            "name": "part.ywzj_vehicle.hook_rear",
            "type": "ywzj_vehicle:hook",
            "structure_bone": "hook_rear",
            "is_seat": false,
            "detachable": false
        }
    ]
}
