{
    "type": "ywzj_vehicle:wheeled_vehicle",
    "attributes": {
        "brake_force": 9000,
        "forward_force": 7200,
        "backward_force": 7200,
        "max_speed_forward": 0.8,
        "max_speed_backward": 0.2,
        "turn_step": 0.4,
        "max_turn": 2
    },
    "physics_info": {
        "mass": 900,
        "friction": 1800,
        "suspension_response": 0.5,
        "center": [0, -1, 0]
    },
    "max_health": 300,
    "defense_stats": {
        "damage_threshold": 10
    },
    "protect_passenger": false,
    "view_info": {
        "third_person_center_offset": [0, 4, 0],
        "third_person_distance": 8,
        "third_person_center_offset_zoomed": [0, 3, 0],
        "third_person_distance_zoomed": 0,
        "sound_distance": 3
    },
    "energy_info": {
        "energy_capacity": 30,
        "energy_consumption_per_tick": 0.000166667,
        "engine_particle_offsets": [[0.645, 1.108, -2.548], [-0.645, 1.108, -2.548]]
    },
    "structure_model": "ywzj_vehicle:vehicle/atv_coyoto",
    "parts": [
        {
            "id": "seat0",
            "name": "part.ywzj_vehicle.seat",
            "type": "ywzj_vehicle:generic",
            "is_seat": true,
            "passenger_pose": {
                "left_arm_rot_x": 4.7,
                "right_arm_rot_x": 4.7,
                "left_leg_rot_x": 4.5,
                "right_leg_rot_x": 4.5
            },
            "seat_offset": [0.4, 1.9, -0.223],
            "owner_view_offset": [0.4, 1.9, -0.223]
        },
        {
            "id": "turret",
            "name": "part.ywzj_vehicle.turret",
            "type": "ywzj_vehicle:weapon",
            "max_health": 100,
            "render_bone": "ctr_machine_gun",
            "structure_bone": "turret",
            "seat_offset": [-0.25, 2.8, -0.5],
            "crosshair_style": "circle",
            "rot_info": {
                "x_rot_speed": 3,
                "y_rot_speed": 3,
                "x_rot_max": 15,
                "x_rot_min": -45,
                "need_power": false
            },
            "passenger_pose": {
                "left_arm_rot_x": 4.5,
                "right_arm_rot_x": 4.5,
                "left_arm_rot_y": 0.3,
                "right_arm_rot_y": -0.3,
                "left_leg_rot_x": 0,
                "right_leg_rot_x": 0
            },
            "optical_sight_offset": [0, 0.3, -0.5],
            "operator_view_offset": [-0.002, 0.5, -0.7],
            "optical_sight_type": "operator",
            "operator_on_weapon_unit": false,
            "zoom_max": 4,
            "weapons": [
                "ywzj_vehicle:gun_12.7mm"
            ]
        },
        {
            "id": "suspension_ctr_wheel_f_l",
            "name": "part.ywzj_vehicle.wheel",
            "type": "ywzj_vehicle:suspension",
            "max_health": 50,
            "defense_stats": {
                "damage_threshold": 0
            },
            "render_bone": "ctr_wheel_f_l",
            "structure_bone": "ctr_wheel_f_l",
            "is_seat": false,
            "spring_stiffness": 27000,
            "damping": 2100,
            "rest_length": 0.35,
            "max_compression": 0.35,
            "max_extension": 0.22,
            "max_droop": 0.22
        },
        {
            "id": "suspension_ctr_wheel_f_r",
            "name": "part.ywzj_vehicle.wheel",
            "type": "ywzj_vehicle:suspension",
            "max_health": 50,
            "defense_stats": {
                "damage_threshold": 0
            },
            "render_bone": "ctr_wheel_f_r",
            "structure_bone": "ctr_wheel_f_r",
            "is_seat": false,
            "spring_stiffness": 27000,
            "damping": 2100,
            "rest_length": 0.35,
            "max_compression": 0.35,
            "max_extension": 0.22,
            "max_droop": 0.22
        },
        {
            "id": "suspension_ctr_wheel_b_l",
            "name": "part.ywzj_vehicle.wheel",
            "type": "ywzj_vehicle:suspension",
            "max_health": 50,
            "defense_stats": {
                "damage_threshold": 0
            },
            "render_bone": "ctr_wheel_b_l",
            "structure_bone": "ctr_wheel_b_l",
            "is_seat": false,
            "spring_stiffness": 27000,
            "damping": 2100,
            "rest_length": 0.35,
            "max_compression": 0.35,
            "max_extension": 0.22,
            "max_droop": 0.22
        },
        {
            "id": "suspension_ctr_wheel_b_r",
            "name": "part.ywzj_vehicle.wheel",
            "type": "ywzj_vehicle:suspension",
            "max_health": 50,
            "defense_stats": {
                "damage_threshold": 0
            },
            "render_bone": "ctr_wheel_b_r",
            "structure_bone": "ctr_wheel_b_r",
            "is_seat": false,
            "spring_stiffness": 27000,
            "damping": 2100,
            "rest_length": 0.35,
            "max_compression": 0.35,
            "max_extension": 0.22,
            "max_droop": 0.22
        },
        {
            "id": "hook_front",
            "name": "part.ywzj_vehicle.hook_front",
            "type": "ywzj_vehicle:hook",
            "structure_bone": "hook_front",
            "is_seat": false,
            "detachable": false
        },
        {
            "id": "hook_rear",
            "name": "part.ywzj_vehicle.hook_rear",
            "type": "ywzj_vehicle:hook",
            "structure_bone": "hook_rear",
            "is_seat": false,
            "detachable": false
        }
    ]
}
