{
  "type": "ywzj_vehicle:rotary_wing_vehicle",
  "attributes": {
    "main_rotor_force": 0.07,
    "x_rot_speed_acceleration": 1.0,
    "x_rot_speed_max": 4.0,
    "y_rot_speed_acceleration": 1.0,
    "y_rot_speed_max": 4.0,
    "z_rot_speed_acceleration": 1.0,
    "z_rot_speed_max": 4.0,
    "max_air_speed": 1.5
  },
  "max_health": 30,
  "view_info": {
    "third_person_center_offset": [0, 6, 0],
    "third_person_distance": 14,
    "sound_distance": 8
  },
  "energy_info": {
    "energy_capacity": 0.25,
    "energy_consumption_per_tick": 0.00001
  },
  "with_warning_receiver": true,
  "structure_model": "ywzj_vehicle:vehicle/ah64d",
  "parts": [
    {
      "id": "sighting_system",
      "name": "sighting_system",
      "type": "ywzj_vehicle:weapon",
      "structure_bone": "sighting_system",
      "seat_offset": [0, 3, 5.13],
      "operator_on_weapon_unit": false,
      "fire_control_lock_type": "aim_hit",
      "rot_info": {
        "x_rot_speed": 3,
        "y_rot_speed": 3,
        "x_rot_max": 45,
        "x_rot_min": -13,
        "y_rot_max": 90,
        "y_rot_min": -90
      },
      "optical_sight_offset": [0, 0.6, 1.2],
      "operator_view_offset": [0, 0.6, 1.2],
      "optical_sight_type": "crt",
      "zoom_max": 12,
      "weapons": [
        {
          "id": "ywzj_vehicle:auto_cannon",
          "part_unit_id": "auto_cannon"
        },
        {
          "id": "ywzj_vehicle:missile",
          "part_unit_id": "missile"
        },
        {
          "id": "ywzj_vehicle:rocket",
          "part_unit_id": "rocket"
        },
        {
          "id": "ywzj_vehicle:decoy_flare",
          "part_unit_id": "decoy_flare"
        }
      ]
    },
    {
      "id": "auto_cannon",
      "name": "auto_cannon",
      "type": "ywzj_vehicle:weapon",
      "structure_bone": "auto_cannon",
      "is_seat": false,
      "crosshair_style": "square",
      "rot_info": {
        "x_rot_speed": 3,
        "y_rot_speed": 3,
        "x_rot_max": 45,
        "x_rot_min": -13,
        "y_rot_max": 90,
        "y_rot_min": -90
      }
    },
    {
      "id": "missile",
      "name": "missile",
      "type": "ywzj_vehicle:weapon",
      "structure_bone": "missile",
      "is_seat": false,
      "parent_weapon_unit_aim": true,
      "crosshair_style": "circle",
      "rot_info": {
        "x_rot_speed": 0,
        "y_rot_speed": 0
      }
    },
    {
      "id": "rocket",
      "name": "rocket",
      "type": "ywzj_vehicle:weapon",
      "structure_bone": "rocket",
      "is_seat": false,
      "crosshair_style": "reticle",
      "rot_info": {
        "x_rot_speed": 0,
        "y_rot_speed": 0
      }
    },
    {
      "id": "decoy_flare",
      "name": "decoy_flare",
      "type": "ywzj_vehicle:weapon",
      "structure_bone": "decoy_flare",
      "is_seat": false,
      "crosshair_style": "none",
      "firing_mode": "salvo",
      "rot_info": {
        "x_rot_speed": 0,
        "y_rot_speed": 0
      }
    }
  ]
}