{
  "type": "ywzj_vehicle:wheeled_vehicle",
  "attributes": {
    "brake_force": 0.02,
    "forward_force": 0.03,
    "backward_force": 0.05,
    "max_speed_forward": 1.2,
    "max_speed_backward": 0.2,
    "turn_step": 1,
    "max_turn": 3
  },
  "max_health": 10,
  "view_info": {
    "third_person_center_offset": [0, 4, 0],
    "third_person_distance": 7,
    "sound_distance": 3
  },
  "energy_info": {
    "energy_capacity": 1,
    "energy_consumption_per_tick": 0.00001,
    "engine_particle_offsets": [[-0.5, 0.5, -3]]
  },
  "structure_model": "ywzj_vehicle:vehicle/hiace",
  "parts": [
    {
      "id": "passenger_seat0",
      "name": "passenger_seat0",
      "type": "ywzj_vehicle:generic",
      "is_seat": true,
      "seat_offset": [0.5, 1.9, 1.5],
      "owner_view_offset": [0.5, 1.9, 1.5]
    },
    {
      "id": "passenger_seat1",
      "name": "passenger_seat1",
      "type": "ywzj_vehicle:generic",
      "is_seat": true,
      "seat_offset": [-0.5, 1.9, 1.5],
      "owner_view_offset": [-0.5, 1.9, 1.5]
    },
    {
      "id": "passenger_seat2",
      "name": "passenger_seat2",
      "type": "ywzj_vehicle:generic",
      "is_seat": true,
      "seat_offset": [0.2, 2, -0.1],
      "owner_view_offset": [0.2, 2, -0.1]
    },
    {
      "id": "passenger_seat3",
      "name": "passenger_seat3",
      "type": "ywzj_vehicle:generic",
      "is_seat": true,
      "seat_offset": [-0.5, 2, -0.1],
      "owner_view_offset": [-0.5, 2, -0.1]
    },
    {
      "id": "passenger_seat4",
      "name": "passenger_seat4",
      "type": "ywzj_vehicle:generic",
      "is_seat": true,
      "seat_offset": [0.2, 2, -1.3],
      "owner_view_offset": [0.2, 2, -1.3]
    },
    {
      "id": "passenger_seat5",
      "name": "passenger_seat5",
      "type": "ywzj_vehicle:generic",
      "is_seat": true,
      "seat_offset": [-0.5, 2, -1.3],
      "owner_view_offset": [-0.5, 2, -1.3]
    }
  ]
}