{
  "type": "ywzj_vehicle:rotary_wing_vehicle",
  "attributes": {
    "main_rotor_force": 0.09,
    "x_rot_speed_acceleration": 1.0,
    "x_rot_speed_max": 3.0,
    "y_rot_speed_acceleration": 1.0,
    "y_rot_speed_max": 3.0,
    "z_rot_speed_acceleration": 1.0,
    "z_rot_speed_max": 3.0,
    "max_air_speed": 1.8
  },
  "max_health": 30,
  "view_info": {
    "third_person_center_offset": [0, 6, 0],
    "third_person_distance": 14,
    "sound_distance": 8
  },
  "energy_info": {
    "energy_capacity": 0.25,
    "energy_consumption_per_tick": 0.00001,
    "engine_particle_offsets": [[-0.9, 2.5, -1], [0.9, 2.5, -1]]
  },
  "structure_model": "ywzj_vehicle:vehicle/ka50",
  "parts": [
    {
      "id": "sighting_system",
      "name": "sighting_system",
      "type": "ywzj_vehicle:weapon",
      "structure_bone": "sighting_system",
      "seat_offset": [-0.2, 2.45, 2.2],
      "operator_on_weapon_unit": false,
      "rot_info": {
        "x_rot_speed": 3,
        "y_rot_speed": 3,
        "x_rot_max": 45,
        "x_rot_min": -13,
        "y_rot_max": 60,
        "y_rot_min": -60
      },
      "optical_sight_offset": [-0.04, 0, 0.01],
      "operator_view_offset": [-0.04, 1.1, -3],
      "optical_sight_type": "crt",
      "zoom_max": 8,
      "weapons": [
        {
          "id": "ywzj_vehicle:auto_cannon",
          "part_unit_id": "auto_cannon"
        },
        {
          "id": "ywzj_vehicle:missile",
          "part_unit_id": "missile"
        },
        {
          "id": "ywzj_vehicle:rocket",
          "part_unit_id": "rocket"
        }
      ]
    },
    {
      "id": "auto_cannon",
      "name": "auto_cannon",
      "type": "ywzj_vehicle:weapon",
      "structure_bone": "auto_cannon",
      "is_seat": false,
      "crosshair_style": "square",
      "rot_info": {
        "x_rot_speed": 3,
        "y_rot_speed": 3,
        "x_rot_max": 45,
        "x_rot_min": 0,
        "y_rot_max": 20,
        "y_rot_min": 0
      }
    },
    {
      "id": "missile",
      "name": "missile",
      "type": "ywzj_vehicle:weapon",
      "structure_bone": "missile",
      "is_seat": false,
      "crosshair_style": "circle",
      "parent_weapon_unit_aim": true,
      "rot_info": {
        "x_rot_speed": 0,
        "y_rot_speed": 0
      }
    },
    {
      "id": "rocket",
      "name": "rocket",
      "type": "ywzj_vehicle:weapon",
      "structure_bone": "rocket",
      "is_seat": false,
      "crosshair_style": "reticle",
      "rot_info": {
        "x_rot_speed": 0,
        "y_rot_speed": 0
      }
    }
  ]
}