{
    "type": "ywzj_vehicle:wheeled_vehicle",
    "attributes": {
        "brake_force": 139000,
        "forward_force": 111200,
        "backward_force": 111200,
        "max_speed_forward": 0.8,
        "max_speed_backward": 0.2,
        "turn_step": 0.4,
        "max_turn": 2
    },
    "physics_info": {
        "mass": 13900,
        "friction": 27800,
        "suspension_response": 0.6,
        "center": [0, -2, 0]
    },
    "max_health": 2000,
    "view_info": {
        "third_person_center_offset": [0, 4, 0],
        "third_person_distance": 10,
        "sound_distance": 3
    },
    "energy_info": {
        "energy_capacity": 230,
        "energy_consumption_per_tick": 0.000555556,
        "engine_particle_offsets": [[-1.672, 1.778, -1.245]]
    },
    "structure_model": "ywzj_vehicle:vehicle/lav_ad",
    "parts": [
        {
            "id": "turret",
            "name": "part.ywzj_vehicle.turret",
            "type": "ywzj_vehicle:weapon",
            "max_health": 600,
            "render_bone": "turret_main",
            "structure_bone": "turret",
            "seat_offset": [-0.5, 2.5, -1],
            "crosshair_style": "circle",
            "rot_info": {
                "x_rot_speed": 3,
                "y_rot_speed": 3,
                "x_rot_max": 4,
                "x_rot_min": -85
            },
            "optical_sight_offset": [-0.565, 0.678, 0.705],
            "operator_view_offset": [-0.7, 1.5, 0],
            "optical_sight_type": "crt",
            "with_stabilizer": true,
            "with_thermal_imager": true,
            "zoom_max": 12,
            "weapons": [
                "ywzj_vehicle:gau_12u",
                {
                    "id": "ywzj_vehicle:fim_92",
                    "part_unit_id": "turret_missile"
                },
                {
                    "id": "ywzj_vehicle:launcher_smoke_grenade",
                    "part_unit_id": "turret_smoke_grenade"
                }
            ]
        },
        {
            "id": "turret_missile",
            "name": "part.ywzj_vehicle.missile",
            "type": "ywzj_vehicle:weapon",
            "structure_bone": "turret_missile",
            "fire_control_sensor_type": "ir",
            "crosshair_style": "none",
            "is_seat": false,
            "parent_weapon_unit_aim": true,
            "rot_info": {
                "x_rot_speed": 1.5,
                "y_rot_speed": 0,
                "x_rot_max": 5,
                "x_rot_min": -60
            }
        },
        {
            "id": "turret_smoke_grenade",
            "name": "part.ywzj_vehicle.turret_smoke_grenade",
            "type": "ywzj_vehicle:weapon",
            "structure_bone": "turret_smoke_grenade",
            "is_seat": false,
            "rot_info": {
                "x_rot_speed": 0,
                "y_rot_speed": 0
            }
        },
        {
            "id": "suspension_wheel7",
            "name": "part.ywzj_vehicle.wheel",
            "type": "ywzj_vehicle:suspension",
            "max_health": 50,
            "defense_stats": {
                "damage_threshold": 0
            },
            "render_bone": "wheel7",
            "structure_bone": "wheel7",
            "is_seat": false,
            "spring_stiffness": 208500,
            "damping": 17125,
            "rest_length": 0.35,
            "max_compression": 0.35,
            "max_extension": 0.22,
            "max_droop": 0.26
        },
        {
            "id": "suspension_wheel8",
            "name": "part.ywzj_vehicle.wheel",
            "type": "ywzj_vehicle:suspension",
            "max_health": 50,
            "defense_stats": {
                "damage_threshold": 0
            },
            "render_bone": "wheel8",
            "structure_bone": "wheel8",
            "is_seat": false,
            "spring_stiffness": 208500,
            "damping": 17125,
            "rest_length": 0.35,
            "max_compression": 0.35,
            "max_extension": 0.22,
            "max_droop": 0.26
        },
        {
            "id": "suspension_wheel5",
            "name": "part.ywzj_vehicle.wheel",
            "type": "ywzj_vehicle:suspension",
            "max_health": 50,
            "defense_stats": {
                "damage_threshold": 0
            },
            "render_bone": "wheel5",
            "structure_bone": "wheel5",
            "is_seat": false,
            "spring_stiffness": 208500,
            "damping": 17125,
            "rest_length": 0.35,
            "max_compression": 0.35,
            "max_extension": 0.22,
            "max_droop": 0.26
        },
        {
            "id": "suspension_wheel6",
            "name": "part.ywzj_vehicle.wheel",
            "type": "ywzj_vehicle:suspension",
            "max_health": 50,
            "defense_stats": {
                "damage_threshold": 0
            },
            "render_bone": "wheel6",
            "structure_bone": "wheel6",
            "is_seat": false,
            "spring_stiffness": 208500,
            "damping": 17125,
            "rest_length": 0.35,
            "max_compression": 0.35,
            "max_extension": 0.22,
            "max_droop": 0.26
        },
        {
            "id": "suspension_wheel3",
            "name": "part.ywzj_vehicle.wheel",
            "type": "ywzj_vehicle:suspension",
            "max_health": 50,
            "defense_stats": {
                "damage_threshold": 0
            },
            "render_bone": "wheel3",
            "structure_bone": "wheel3",
            "is_seat": false,
            "spring_stiffness": 208500,
            "damping": 17125,
            "rest_length": 0.35,
            "max_compression": 0.35,
            "max_extension": 0.22,
            "max_droop": 0.26
        },
        {
            "id": "suspension_wheel4",
            "name": "part.ywzj_vehicle.wheel",
            "type": "ywzj_vehicle:suspension",
            "max_health": 50,
            "defense_stats": {
                "damage_threshold": 0
            },
            "render_bone": "wheel4",
            "structure_bone": "wheel4",
            "is_seat": false,
            "spring_stiffness": 208500,
            "damping": 17125,
            "rest_length": 0.35,
            "max_compression": 0.35,
            "max_extension": 0.22,
            "max_droop": 0.26
        },
        {
            "id": "suspension_wheel2",
            "name": "part.ywzj_vehicle.wheel",
            "type": "ywzj_vehicle:suspension",
            "max_health": 50,
            "defense_stats": {
                "damage_threshold": 0
            },
            "render_bone": "wheel2",
            "structure_bone": "wheel2",
            "is_seat": false,
            "spring_stiffness": 208500,
            "damping": 17125,
            "rest_length": 0.35,
            "max_compression": 0.35,
            "max_extension": 0.22,
            "max_droop": 0.26
        },
        {
            "id": "suspension_wheel1",
            "name": "part.ywzj_vehicle.wheel",
            "type": "ywzj_vehicle:suspension",
            "max_health": 50,
            "defense_stats": {
                "damage_threshold": 0
            },
            "render_bone": "wheel1",
            "structure_bone": "wheel1",
            "is_seat": false,
            "spring_stiffness": 208500,
            "damping": 17125,
            "rest_length": 0.35,
            "max_compression": 0.35,
            "max_extension": 0.22,
            "max_droop": 0.26
        },
        {
            "id": "hook_front",
            "name": "part.ywzj_vehicle.hook_front",
            "type": "ywzj_vehicle:hook",
            "structure_bone": "hook_front",
            "is_seat": false,
            "detachable": false
        },
        {
            "id": "hook_rear",
            "name": "part.ywzj_vehicle.hook_rear",
            "type": "ywzj_vehicle:hook",
            "structure_bone": "hook_rear",
            "is_seat": false,
            "detachable": false
        }
    ]
}
